### ISSUE TITLE
ESP8266WebServer Problem accessing webpages from another subnet

### ISSUE THREAD

**Issue by PabloVogel** [esp8266/Arduino#4153]
Please fill the info fields, it helps to get you faster support ;)

if you have a stack dump decode it:
https://github.com/esp8266/Arduino/blob/master/doc/Troubleshooting/stack_dump.rst

for better debug messages:
https://github.com/esp8266/Arduino/blob/master/doc/Troubleshooting/debugging.rst

----------------------------- Remove above -----------------------------

#### Hardware
Hardware:			sonoff (esp 1m)
Core Version:      	2.4.0

### Description

When accessing the webpages through  a router using the ESP8266WebServer class the contents of the page are not sent. This doesn't happen with version 2.3.0 of the framework.

```
webServer->send(200, FPSTR(HDR_CTYPE_HTML), page); 
```
sends only "HTTP: HTTP/1.1 200 OK" but not the contents of page.

Accessing the same page thru the local broadcast network gives the correct result

at the end are the traces, first from the router second from the tcpdump inside the client host.

Server ESP is located on 192.168.40.0/24 and client is on 192.168.10.0/24. There are no issues with any computer or devices except for the ESP with firmware 2.4.0. Same problems occur through VPNs

After the packet seq 1:169 "HTTP: HTTP/1.1 200 OK" is received, the client host responds with an ACK and then no more packets are sent by the ESP server. This behavior does not occur with if the string page is small.

When the same request is made in the local subnet two more packets follow the ACK a 1460 and a 1036 byte packets.

Same behavior is observed also with ESPEasy firmware  as with sonoff-tasmota, sorry I don't include the sketch but they are too big.

### Settings in IDE

Module:  		Generic ESP8266 Module
Flash Size: 		/1MB?
CPU Frequency:	80Mhz
Flash Mode:	        dio
Flash Frequency:	40Mhz
Upload Using:	OTA and SERIAL
Reset Method:       ck

### Sketch

```cpp

#include <Arduino.h>

void setup() {

}

void loop()
{
  OsWatchLoop();

  if (millis() >= state_loop_timer)
    StateLoop();

  PollDnsWebserver();

  if (!mqttLoop && Settings.flag.mqtt_enabled) {
    mqttLoop = true;
    MqttClient.loop();
    mqttLoop=false;
  }
  delay(sleep);
}

void PollDnsWebserver()
{
  if (polling) return;
  polling = true;
  if (DnsServer) {
    DnsServer->processNextRequest();
  }
  if (WebServer) {
    WebServer->handleClient();
  }
  polling = false;
}

```

### Debug Messages

```
   1: 16:48:21.669597       802.1Q vlan#10 P2 192.168.10.20.38696 > 192.168.40.217.80: S 324400525:324400525(0) win 29200 <mss 1460,sackOK,timestamp 391693608 0,nop,wscale 6>
   2: 16:48:21.669734       802.1Q vlan#40 P2 192.168.10.20.38696 > 192.168.40.217.80: S 1389100936:1389100936(0) win 29200 <mss 1380,sackOK,timestamp 391693608 0,nop,wscale 6>
   3: 16:48:21.673366       802.1Q vlan#40 P2 192.168.40.217.80 > 192.168.10.20.38696: S 7038:7038(0) ack 1389100937 win 5840 <mss 1460>
   4: 16:48:21.673396       802.1Q vlan#10 P2 192.168.40.217.80 > 192.168.10.20.38696: S 1869546902:1869546902(0) ack 324400526 win 5840 <mss 1380>
   5: 16:48:21.675837       802.1Q vlan#10 P2 192.168.10.20.38696 > 192.168.40.217.80: . ack 1869546903 win 29200
   6: 16:48:21.675868       802.1Q vlan#40 P2 192.168.10.20.38696 > 192.168.40.217.80: . ack 7039 win 29200
   7: 16:48:21.680506       802.1Q vlan#10 P2 192.168.10.20.38696 > 192.168.40.217.80: P 324400526:324400644(118) ack 1869546903 win 29200
   8: 16:48:21.680522       802.1Q vlan#40 P2 192.168.10.20.38696 > 192.168.40.217.80: P 1389100937:1389101055(118) ack 7039 win 29200
   9: 16:48:21.722603       802.1Q vlan#40 P2 192.168.40.217.80 > 192.168.10.20.38696: P 7039:7207(168) ack 1389101055 win 5722
  10: 16:48:21.722618       802.1Q vlan#10 P2 192.168.40.217.80 > 192.168.10.20.38696: P 1869546903:1869547071(168) ack 324400644 win 5722
  11: 16:48:21.724266       802.1Q vlan#10 P2 192.168.10.20.38696 > 192.168.40.217.80: . ack 1869547071 win 30016
  12: 16:48:21.724282       802.1Q vlan#40 P2 192.168.10.20.38696 > 192.168.40.217.80: . ack 7207 win 30016
  13: 16:48:25.596664       802.1Q vlan#10 P2 192.168.10.20.38696 > 192.168.40.217.80: F 324400644:324400644(0) ack 1869547071 win 30016
  14: 16:48:25.596694       802.1Q vlan#40 P2 192.168.10.20.38696 > 192.168.40.217.80: F 1389101055:1389101055(0) ack 7207 win 30016
  15: 16:48:25.617567       802.1Q vlan#40 P2 192.168.40.217.80 > 192.168.10.20.38696: . ack 1389101056 win 5721
  16: 16:48:25.617598       802.1Q vlan#10 P2 192.168.40.217.80 > 192.168.10.20.38696: . ack 324400645 win 5721
16 packets shown.
0 packets not shown due to performance limitations



pablo@Schumann:~ $ sudo tcpdump -e host 192.168.40.217
tcpdump: verbose output suppressed, use -v or -vv for full protocol decode
listening on eth0, link-type EN10MB (Ethernet), capture size 262144 bytes
21:04:09.606772 b8:27:eb:ac:27:e5 (oui Unknown) > e8:65:49:6b:ea:9c (oui Unknown), ethertype IPv4 (0x0800), length 74: schumann.v-Ruga.COM.38696 > 192.168.40.217.http: Flags [S], seq 324400525, win 29200, options [mss 1460,sackOK,TS val 391693608 ecr 0,nop,wscale 6], length 0
21:04:09.612306 e8:65:49:6b:ea:9c (oui Unknown) > b8:27:eb:ac:27:e5 (oui Unknown), ethertype IPv4 (0x0800), length 60: 192.168.40.217.http > schumann.v-Ruga.COM.38696: Flags [S.], seq 1869546902, ack 324400526, win 5840, options [mss 1380], length 0
21:04:09.613065 b8:27:eb:ac:27:e5 (oui Unknown) > e8:65:49:6b:ea:9c (oui Unknown), ethertype IPv4 (0x0800), length 54: schumann.v-Ruga.COM.38696 > 192.168.40.217.http: Flags [.], ack 1, win 29200, length 0
21:04:09.617755 b8:27:eb:ac:27:e5 (oui Unknown) > e8:65:49:6b:ea:9c (oui Unknown), ethertype IPv4 (0x0800), length 172: schumann.v-Ruga.COM.38696 > 192.168.40.217.http: Flags [P.], seq 1:119, ack 1, win 29200, length 118: HTTP: GET / HTTP/1.1
21:04:09.660842 e8:65:49:6b:ea:9c (oui Unknown) > b8:27:eb:ac:27:e5 (oui Unknown), ethertype IPv4 (0x0800), length 222: 192.168.40.217.http > schumann.v-Ruga.COM.38696: Flags [P.], seq 1:169, ack 119, win 5722, length 168: HTTP: HTTP/1.1 200 OK
21:04:09.661542 b8:27:eb:ac:27:e5 (oui Unknown) > e8:65:49:6b:ea:9c (oui Unknown), ethertype IPv4 (0x0800), length 54: schumann.v-Ruga.COM.38696 > 192.168.40.217.http: Flags [.], ack 169, win 30016, length 0
21:04:13.533808 b8:27:eb:ac:27:e5 (oui Unknown) > e8:65:49:6b:ea:9c (oui Unknown), ethertype IPv4 (0x0800), length 54: schumann.v-Ruga.COM.38696 > 192.168.40.217.http: Flags [F.], seq 119, ack 169, win 30016, length 0
21:04:13.555730 e8:65:49:6b:ea:9c (oui Unknown) > b8:27:eb:ac:27:e5 (oui Unknown), ethertype IPv4 (0x0800), length 60: 192.168.40.217.http > schumann.v-Ruga.COM.38696: Flags [.], ack 120, win 5721, length 0
^C
8 packets captured
8 packets received by filter
0 packets dropped by kernel
~                                   

```

**Comment by earlephilhower** [comment]
This bug is a year old and the MCVE doesn't compile.  There's nothing we can do here.  If you're still having issues, please open a new bug with the latest core 2.5.0 and provide a working MCVE, or else there's little the maintainers can do.
